{
  "schemaVersion": 1,
  "application": "WinAudioClean",
  "status": "draft",
  "version": "1.0.0",
  "date": null,
  "download": {
    "url": null,
    "fileName": null,
    "sha256": null,
    "bytes": null
  },
  "source": {
    "commit": null,
    "tree": null
  },
  "requirements": {
    "platforms": ["Windows desktop; Windows 10/11 are intended targets. Other builds and managed security configurations are not universally verified."],
    "powershell": ["5.1", "7"],
    "ffmpeg": "Supply trusted Windows FFmpeg and ffprobe separately, with the required filter capabilities. Neither is bundled or downloaded automatically.",
    "installation": "Extract every tool-only package file into a short user-writable folder. No administrator rights, Git, Python or test modules are required to run the tool.",
    "privacy": "Audio processing stays on your machine. Selected input/output folders can still be network or synchronized storage; reports can contain private paths and filenames."
  }
}
